### ISSUE TITLE
TCP RSTs replied-to with ACKs

### ISSUE THREAD

**Issue by Dirbaio** [smoltcp-rs/smoltcp#338]
I'm seeing a strange issue in the `server` example where the connection is not properly closed, and things get stuck in a loop of Linux sending a RST, smoltcp replying with an ACK, and Linux sending a RST to the ACK, and so on.

How to reproduce:

```sh
sudo ip tuntap add name tap0 mode tap user $USER
sudo ip link set tap0 up
sudo ip addr add 192.168.69.100/24 dev tap0
sudo ip -6 addr add fe80::100/64 dev tap0
sudo ip -6 addr add fdaa::100/64 dev tap0
sudo ip -6 route add fe80::/64 dev tap0
sudo ip -6 route add fdaa::/64 dev tap0
cargo run --example server -- tap0
```

In another terminal, run

```sh
socat stdio tcp4-connect:192.168.69.1:6972 >/dev/null
```

Wait 1-2 seconds and press control+c. If smoltcp keeps printing debug output, you have reproduced the bug. Doesn't always happen, sometimes takes 2-3 tries but it in the end it always happens.

It seems to me that this is actually 2 bugs.
- Problem in the sequence number check for RSTs. Looks like an off-by-one
- RSTs that fail the sequence number check shouldn't get an ACK reply.

---

Debug output:

```
[1587938687.534s] <- EthernetII src=56-cf-3d-3a-b7-94 dst=02-00-00-00-00-01 type=IPv4
                \ IPv4 src=192.168.69.100 dst=192.168.69.1 proto=TCP
                 \ TCP src=55710 dst=6972 rst seq=3200577701 win=0 len=0
[1587938687.535s] (socket::tcp): window: 3200577702-3200643237 segment: 3200577701-3200577701
[1587938687.535s] (socket::tcp): #4:192.168.69.1:6972:192.168.69.100:55710: received a keep-alive or window probe packet, will send an ACK
[1587938687.535s] (socket::tcp): sending sACK option with current assembler ranges
[1587938687.535s] -> EthernetII src=02-00-00-00-00-01 dst=56-cf-3d-3a-b7-94 type=IPv4
                \ IPv4 src=192.168.69.1 dst=192.168.69.100 proto=TCP
                 \ TCP src=6972 dst=55710 seq=1097336082 ack=3200577701 win=65535 len=0
```

Packet capture:

```
192.168.69.100	192.168.69.1	TCP	54     55710 → 6972 [ACK] Seq=1 Ack=2939351 Win=1311744 Len=0
192.168.69.1	192.168.69.100	TCP	1514   6972 → 55710 [ACK] Seq=2939351 Ack=1 Win=65535 Len=1460
192.168.69.1	192.168.69.100	TCP	1514   6972 → 55710 [ACK] Seq=2940811 Ack=1 Win=65535 Len=1460
192.168.69.100	192.168.69.1	TCP	54     55710 → 6972 [ACK] Seq=1 Ack=2942271 Win=1311744 Len=0
192.168.69.1	192.168.69.100	TCP	1514   6972 → 55710 [ACK] Seq=2942271 Ack=1 Win=65535 Len=1460
192.168.69.1	192.168.69.100	TCP	1514   6972 → 55710 [ACK] Seq=2943731 Ack=1 Win=65535 Len=1460
192.168.69.100	192.168.69.1	TCP	54     55710 → 6972 [ACK] Seq=1 Ack=2945191 Win=1311744 Len=0
192.168.69.100	192.168.69.1	TCP	54     55710 → 6972 [FIN, ACK] Seq=1 Ack=2945191 Win=1311744 Len=0
192.168.69.1	192.168.69.100	TCP	1349   6972 → 55710 [PSH, ACK] Seq=2945191 Ack=1 Win=65535 Len=1295
192.168.69.100	192.168.69.1	TCP	54     55710 → 6972 [RST] Seq=1 Win=0 Len=0
192.168.69.1	192.168.69.100	TCP	54     [TCP Dup ACK 6#1] 6972 → 55710 [ACK] Seq=2946486 Ack=1 Win=65535 Len=0
192.168.69.100	192.168.69.1	TCP	54     55710 → 6972 [RST] Seq=1 Win=0 Len=0
192.168.69.1	192.168.69.100	TCP	54     [TCP Dup ACK 6#2] 6972 → 55710 [ACK] Seq=2946486 Ack=1 Win=65535 Len=0
192.168.69.100	192.168.69.1	TCP	54     55710 → 6972 [RST] Seq=1 Win=0 Len=0
192.168.69.1	192.168.69.100	TCP	54     [TCP Dup ACK 6#3] 6972 → 55710 [ACK] Seq=2946486 Ack=1 Win=65535 Len=0
192.168.69.100	192.168.69.1	TCP	54     55710 → 6972 [RST] Seq=1 Win=0 Len=0
192.168.69.1	192.168.69.100	TCP	54     [TCP Dup ACK 6#4] 6972 → 55710 [ACK] Seq=2946486 Ack=1 Win=65535 Len=0
192.168.69.100	192.168.69.1	TCP	54     55710 → 6972 [RST] Seq=1 Win=0 Len=0
```

Full pcap: [rst-bug.tar.gz](https://github.com/smoltcp-rs/smoltcp/files/4536586/rst-bug.tar.gz)
Verified happening both on Linux 5.6 and 5.7.0-rc2.

**Comment by Dirbaio** [comment]
I think I know why this happens.

This is when the bug *doesn't happen*:
```

[1591912309.857s] <- EthernetII src=56-cf-3d-3a-b7-94 dst=02-00-00-00-00-01 type=IPv4
                \ IPv4 src=192.168.69.100 dst=192.168.69.1 proto=TCP
                 \ TCP src=54784 dst=6972 fin seq=1400008747 ack=2898312681 win=10302 len=0

window: 1400008747-1400074282 segment: 1400008747-1400008748
[1591912309.857s] (socket::tcp): #4:192.168.69.1:6972:192.168.69.100:54784: state=ESTABLISHED=>CLOSE-WAIT
[1591912309.857s] (socket::tcp): #4:192.168.69.1:6972:192.168.69.100:54784: tx buffer: dequeueing 1460 octets (now 52395)
[1591912309.857s] (socket::tcp): #4:192.168.69.1:6972:192.168.69.100:54784: outgoing segment will send data or flags
[1591912309.857s] (socket::tcp): #4:192.168.69.1:6972:192.168.69.100:54784: tx buffer: sending 1460 octets at offset 0

[1591912309.857s] -> EthernetII src=02-00-00-00-00-01 dst=56-cf-3d-3a-b7-94 type=IPv4
                \ IPv4 src=192.168.69.1 dst=192.168.69.100 proto=TCP
                 \ TCP src=6972 dst=54784 seq=2898312681 ack=1400008748 win=65535 len=1460

[1591912309.857s] <- EthernetII src=56-cf-3d-3a-b7-94 dst=02-00-00-00-00-01 type=IPv4
                \ IPv4 src=192.168.69.100 dst=192.168.69.1 proto=TCP
                 \ TCP src=54784 dst=6972 rst seq=1400008748 ack=2898312681 win=10303 len=0

window: 1400008748-1400074283 segment: 1400008748-1400008748
[1591912309.857s] (socket::tcp): #4:192.168.69.1:6972:192.168.69.100:54784: received RST
[1591912309.857s] (socket::tcp): #4:192.168.69.1:6972:192.168.69.100:54784: state=CLOSE-WAIT=>CLOSED
```

- Linux sends FIN
- smoltcp ACKs the FIN
- Linux sees the ACK, replies with RST with the correct updated seq from the ACK
- smoltcp accepts the RST

Compare with this, when the bug *does* happen:

```

[1591912312.937s] <- EthernetII src=56-cf-3d-3a-b7-94 dst=02-00-00-00-00-01 type=IPv4
                \ IPv4 src=192.168.69.100 dst=192.168.69.1 proto=TCP
                 \ TCP src=54788 dst=6972 fin seq=999869563 ack=3298717090 win=10302 len=0

window: 999869563-999935098 segment: 999869563-999869564
[1591912312.937s] (socket::tcp): #4:192.168.69.1:6972:192.168.69.100:54788: state=ESTABLISHED=>CLOSE-WAIT
[1591912312.937s] (socket::tcp): #4:192.168.69.1:6972:192.168.69.100:54788: tx buffer: dequeueing 2920 octets (now 48015)

[1591912312.937s] <- EthernetII src=56-cf-3d-3a-b7-94 dst=02-00-00-00-00-01 type=IPv4
                \ IPv4 src=192.168.69.100 dst=192.168.69.1 proto=TCP
                 \ TCP src=54788 dst=6972 rst seq=999869563 win=0 len=0

window: 999869564-999935099 segment: 999869563-999869563

[1591912312.937s] (socket::tcp): #4:192.168.69.1:6972:192.168.69.100:54788: received a keep-alive or window probe packet, will send an ACK
[1591912312.937s] (socket::tcp): sending sACK option with current assembler ranges

[1591912312.938s] -> EthernetII src=02-00-00-00-00-01 dst=56-cf-3d-3a-b7-94 type=IPv4
                \ IPv4 src=192.168.69.1 dst=192.168.69.100 proto=TCP
                 \ TCP src=6972 dst=54788 seq=3298718550 ack=999869563 win=65535 len=0

[1591912312.938s] <- EthernetII src=56-cf-3d-3a-b7-94 dst=02-00-00-00-00-01 type=IPv4
                \ IPv4 src=192.168.69.100 dst=192.168.69.1 proto=TCP
                 \ TCP src=54788 dst=6972 rst seq=999869563 win=0 len=0
```

- Linux sends FIN
- smoltcp doesn't ACK the FIN
- Linux sees a stale packet, replies with RST with the OLD seq from that stale packet
- smoltcp correctly rejects the RST
- smoltcp sends the challenge ack with the WRONG ack number
- Linux sends the RST again with the OLD seq
- infinite loop

This happens becayse `ack_reply` sends the ack number from  `self.remote_last_ack`, which only gets updated by `dispatch`. But `dispatch` is never being called, probably because ingress is looping forever due to the storm of packets? This seems like #281.
